pokemon,title_cleaned
1,i added a paldean wooper and some friends to this drawing over the course of  days oc
1,elements from various games that have disappeared but would make an excellent game if used together
1,i miss rd version
1,i made a large shadow jumbo for the first time
1,we can be together at twilight  oc
1,you ever get the feeling youre being watched
1,my first tattoo after getting recently married so i got an espeon
1,my old fan art of my sona in pla setting
1,in defense of future paradox pokemon
1,my platinum team
1,after ghastly i tried drawing mew i think i made him bigger than he should be 
1,oc my first attempt at painting fan pokemon  shooting umbra is inspired by dreepys entry a sea creature of ancient times
1,just me or do the little dudes look like gimmigoul
1,jangmoo wants to play by me
1,oc my first attempt at some gen  style pokémon pixel art its a komala  i made everything but the background
1,magnemite animation  blender  after effects
1,did a little wooper drawing
1,my friend posted this on their status 
1,my fakemon regions gimmick bestowed forms more info in the comments
1,walking wake getting banned be like
1,what if lugia but velociraptor oc
1,lake sleep  oc 
1,party missing after gold bug contest
1,you all gave amazing feedback to my previous transfer chart it was incomplete so i made an updated chart again oc
1,i got my favourite evolution line tattooed over the weekend artist markm_tatts
1,oc i tried to draw charizard who should i do next
1,been seeing these around so i did one
1,macargo and heatmor
1,simps anyone
1,my brilliant diamond team before the elite  wish me luck
1,drawing a commission of charmander cant wait to color it
1,oc what unique trait is shared by these pokémon
1,got to catch them all
1,my most recent drawing i have a bunch more i was really proud of it
1,so me and my friend were discussing how the timeline is split between mega and none mega and i made this
1,should toby fox be hired to work with gamefreak for the music of pokémon from now on
1,i crocheted my favorite starter piplup 
1,mew themed pc case i made
1,has anyone gotten a walking wake with no good attack
1,i drew cynthia
1,delphox oc
1,pokemon togepi uses hydro cannon
1,what happened to the prices of bw
1,chatgpt whos that pokémon  info in comments
1,i made this illustration for my brother did you like it what is your favorite pokemon
1,in theory could you mega evolve and gigantmax at the same time
1,my drawing of psyduck
1,guessing terapagos typing
1,oc meet ledoof if you know you know
1,whos a character you wanted to know more about
1,poor raikou is tired of this and im tired of having to keep reposting this because it gets removed
1,planning out my bathroom repaint is fun
1,i attempted at designing a paradox ampharos its lights remind me of anglerfish and its limb shapes remind me of plesiosaurus i have mixed feelings about it
1,i want real evil teams back
1,mega evolution cant return
1,for you whats the definitive version of hoenn 
1,looking for gift
1,would you enjoy a noncompetitive battle in my gym
1,pokemon sv
1,checking to see if i got an accidental trade
1,took a while but i put all my favorites yes i am somewhat basic
1,rate this shot oak
1,how do you feel about my rendition of paradox hitmontop its based off the original beta form oc
1,ok so there is this thing called raise a digimon or digimon sim so im making one for pokémon you can train raise or battle these  as they are rivals ive also given you a translator so you can talk to them i have a list of items in the comments for you all to use have fun
1,best moment in pokemon
1,which isnt a lot but its weird that it happend twice in the same gen
1,a sprigatito artwork to celebrate the past release of the new pokemon games
1, oc  rayquaza art
1,pokémon team for steve from minecraft this is part  of a multipart game
1,oc armarouge knight aflame
1,made an effort not to give pokémon with dual typing a slot on each type so i like some of them way more than others
1,a question
1,bro
1,water starter pokemon reuploaded version
1,psyyyyduck
1,my favorite pokemon roast me
1,completely handmade arcanine and growlithe pokérarium oc
1, fuecoco evolution speed drawing
1,theme talk new favorite pokémon chart
1,oc riding the wave
1,my minimalist sabrina  natsume fanart
1,my torchic tattoo
1,got pokerus while making a youtube video
1,websites be like
1,hydreigon past paradox form oc commission
1,virizion is mostly seen as a female is it really a female though
1,oc tried to make my first art of a paldean pokemon
1,is he referencing arceus from pokemon cant think of anything else
1,trade evos
1,im scared
1,mega lopunny x mega gardevoir
1,designed a resin printable origin ball
1,roast my favorites
1,walking wake gouache painting process oc
1,first one is my favorite the second one is the worst
1,im playing pokefarmq and they wont give me my pixels
1,tried this chart out still missing a few pokemon tho and i never played gen  so i dont have many favorites there
1,took me a lot of hours to complete but im satisfied  hyperagua studios eeveelution emblem hope you like it oc
1,walking wake drawn by me oc
1,first try baby i wanted to use explosion on garchomp but my golem died to it before he could the only pokémon to survive was grumpig
1,curious about these odds
1,definitely giving pokémon red and blue vibes
1,gothiunny
1,violet team gijinkas oc
1,i dislike fakemon
1,slaagron a firetype aggron
1,i need help choosing
1,hope im not late for the pokèmonday
1,which legendary battles do you have to win and which can you catch or skip
1,a friend made this for me back in  any dragonite fans out there
1,which switch pokenln should i get
1,kotaku a pokémon scarlet and violet bug is deleting players save files
1,ongoing progress to the sleeveelution tattoo i posted last year
1,im not a charizard fanboy but
1,thought on making a new pokemon ranger
1,i crocheted a cofagrigus
1,drew a fan made paradox form of swoobat procreate
1,this realization came to me this morning oc
1,anyone know where i can catch porygon in white 
1,does anyone else think iron leaves and valiant are related somehow oc
1,these animations are simply incredible
1,this took me a while but try and guess what my first game was and let me know what you think of my selections
1,oc i drew my armarouge i love my armarouge
1,datamined next raid event  decidueye
1,gen  sabrina  i made this  art markers
1,oc a bunch of artworks and commissions ive done and a fakemon
1,rate my custom trainersona and pokémon team
1,is worlds worth it if youre not competing
1,what are your most forgettable pokemon in each generation
1,making a sandwich in pokemon scarletviolet be like
1,pokemon digital painting by artejusino oc
1,look who im making
1,i finally beat my first nuzlocke challenge
1,what type would you give a dentist themed gym leader
1,i filled in the entire frlg map
1,best postgame
1,hes basically th gens az with the difference hes just in the code
1,how to get deoxys
1,gimmighoul be like
1,more pokefusions
1,i made a clay oddish planter
1,espeon and umbreon i made today
1,pokemon card  acryllic paint 
1,this time ive made a venusaur
1,mega gardevoir shiny just the best fanart by me
1,umbreon
1,my dad baked my best friend a bellibolt cake for his th birthday
1,my fiancee started making minimalistic pokemon art and i thought yall might like them
1,i lost most of my most beloved pokémon today
1,how much do you guys think my pokémon collection is worth one of the pokémon red blue and diamond has a repo label everything here is  authentic
1,my new pachirisu painting
1,umm thats a new one
1,drawing project of polifam
1,if you lived in the pokemon world what pokemon would you keep solely as a pet and never battle with mine would be poocheyana since i love dogs and they look like my lil dog bonnie
1,why does masuda even bother with remakes if this is how hes gonna do them
1,we need justice for this guy
1,would genning not legit obtention be ok in this case
1,my idea for pokemon moving even after ds online gets completely shut down
1,pokemon live sucks
1,oc didnt want to post until i finished both but made shiny poochyena and mightyena
1,eevee but cubular
1,whats up everyone im back with a brand new shadowbox i present rockruff tg in d oc
1,what if they added more functionality with the different pokeballs
1,i made walking wake fanart by me
1,drew solgaleo  lunala over the weekend
1,loaf of code
1,my clodsire is complete
1,oc what could he be doing
1,am i weird for being like this
1,oc diglett made from polymer clay
1,ive always wanted to draw ghastly and happy how it turned out 
1,is curse a one of a kind move
1,new pokémon typinp speculation thread
1,these new pokémon seem so paradoxical
1,what signature move would you make more widespread and who would you give it to
1,this took a while but i finished and im happy the anime is finishing
1,why pokemon mystery dungeon explorers of sky will always be the most emotional video game in my lifetime and how replaying it has been one of the most intense experiences ive ever had playing a game
1,finally my pokémon project is now pokemon can you spot  of the  new pokemon revealed from the dlc in the second pic i have not drawn terapagos yet since im unsure how bigsmall it actually is so ill have to wait until i have a reference for that
1,which pokémon games would you recommend
1,encounter with a tangrowth oc
1,dream blunt rotation
1,armarouge and ceruledge without armor
1,lycanzoi
1,i think we have a bond a huge bond
1,thats what i see with the big loop on his head tubbie wake
1,playing white for the first time and had to catch a lillipup in honor of my yorkie i lost years ago 
1,oc cat and dog
1,commission i did a while back
1, fidough
1,my take on the paradox beast from the scarlet book
1,cranidos and rampardos ink drawing  one of my favorite fossil pokémon lines commissions open
1,i beat pokémon shining pearl three times because i hate myself i spent sixty four hours and thirty seven minutes wasting my life in these garbage games i have no idea how i got the motivation to beat this game  times
1,what mega pokémon should i draw
1,problem with soft reset
1,the many origins of shiinotic an overly long analysis of the most underappreciated alolan pokémon tldr at the end
1,oc speedpaint  little hazard friend 
1,a few months ago i finished this clay whooper thought i might as well show it off
1,love this mousepad
1,can somebody give me the type math for if all  types were on  pokemon
1,the supreme fossil pokemon has been chosen paradox charizard i mean aerodactyl
1,if only this music could be what plays in the background immediately after we die
1,oc heres a drawing i made of dedenne what do you think
1,oc ash and flora 
1,has the game ever actually changed after becoming champion
1,spriting help needed
1,luden psyduck
1,oc had the idea to paint snorlax as a balloon
1,does anyone feel like they should bring back roaming legendaries in scarlet and violet
1,my violet team
1,my favorite elite four drawn  years ago on this day decide to draw her with her lapras oc
1,fan art of some pokémon walking in the forest 
1,charizard golden emblem tribute edition oc
1,is this gameboy advance an official console or custom made ive seen this system over the internet but i could never see it sold with an original pokémon box i cant find this version in any lists either is it made from pokémon or do people custom make them
1,so you just always have bread sv
1,oc facebook reminded me of this fanart i made for a friend today i still like it
1,dlc paradox pokémon theory theory in comments
1,rebuild tuesday electivire
1,i dont know if i should be proud of this or despise it with every cell of my being
1,imposter syndrome
1,espeon  umbreon  toads daily pokémon ranking   
1,what feature new or old would you love to have in the games but think nobody else would likecare about
1,oc pokémon duel from cang lan jue
1,im not wrong
1,pikachu remembers his past battles
1,lusamine vs sada ai favorite malicious mom
1,banette should get play rough you cannot change my mind
1,its my first meme so sry for bad quality
1,torchic and magnemite plus i played with rawtherapees vignette filter for watching the sunset
1,togepi gift 
1,samurott and his deformed siblings
1,do you ever sometimes feel pokemon wouldve looked better if it stayed d pixel art
1,oc drawing of the teal mask ogerpon 
1,whats your best idea for a regional ditto
1,mega dragonite ill color it later what should i draw next
1,hes waiting to be adopted oc
1,yamper
1,heres a sad smolliv to get you through the day
1,oc i promise ill post some more complex digital stuff later but wooowoo yeah small drawings of some pokemon i like 
1,skeledirge is such a great pokémon i love this big fire croc and his little phoenix  artist credit akumiboshi
1,me and my favourite pokémon of all time in the d sprite artstyle
1,netflix liveaction adaptation
1,old pokemon character creator on official website in early s
1,i tried to write down the type chart in excel without using a reference i think it went pretty well
1,in terms of lets go steps for evolution how far across is asado desert
1,finish the hoenn starters im learning xd what gen should i try next
1,how did you feel when game freak started giving old pokémon new evolutions
1,oc a sketch of gholdengo and tinkatink i drew
1,what do you nickname your pokemon  pawmi pawmo pawmot
1,kangaskhan evolution kanganate oc
1,prediction about pokemon scarlet and violet dlc
1,im done
1,stumpidori
1,never did a fan alternate box art before but i was inspired because of how awesome lets go pikachu is thought it would be appreciated here
1,what pokemon are rare for each region
1,i cant beat iron leaves any help from the community
1,derpian pikachu  by s n valadez
1,oc nimbus neck used zap cannon original design by uarchist
1,scarvio just keep on giving
1,this is the first main series game in which i have committed the unspeakable
1,battle request thread  march 
1,cyndaquil redesign 
1,pokémon lofi and chill 
1,which paradox pokémon timeline forms you like more past or future
1,two theories about the treasure of area zero dlc
1,soulink suggestions
1,in lgfr you can hear pokemon cries if you stand still in a patch of grass for about a minute
1,which pseudo legendaries are actually usable in a play through
1,having fun oc
1,i love shedninja but
1,why is cyndaquil called hinoa and totodile called wanin
1,made this edit
1,pokemon sv paradox trading help
1,if you could make a new signature move what would it be and which pokémon would have it
1,which is the best pokemon ost of all
1,a compilation of some of my combatbased pokemon animations
1,can you do masuda method on union circle
1,battle team help
1,pokestar studios
1,why has breeding hacked mons become mainstream
1,how does pokemons ball passing down work
1,why is my murkrow using quash after the foe talonflame 
1,a bit of help for those struggling with walking wake  iron leaves raids
1,a deep dive into the origins of tinglu tldr at the end
1, oc  shiny silver shinyy lugia fanmade edit  a little bit of a quick one i suppose lol 
1,i have an idea for a little game
1,need ideas for a themed pokemon theme in heartgold
1,if pokémon scarlet and violet got balance patches which pokémon including transfer only do you think should get buffednerfed how and why
1,restore pp without an item picnic or pokecenter
1,theyre the same picture
1,just found a random usb in the back of my draw this was the only thing on it
1,minecraft styled pokemon magikarp and mareep so far
1,is pokemon bank going to be free after march 
1,got blocked from doing random raids because of a glitch
1,pokemon on vr
1,hot takeold pokémon games arent better than current ones
1,what other possible ancestors would you like to see in a potential legends arceus sequel possible spoilers
1,how does kirby an arguably toddler franchise have a difficulty option and pokemon doesnt
1,if superman had a pokemon which one would it be
1,anyway to guarantee a leafstone before getting to kanto
1,drew one of my favourite pokemon today  arcanine is the cutest
1,instead of botw i wish pokemon was more like yakuza
1,why so many charizards in the anime
1,volcarona and drought
1,eevee evolutions as jedi
1,hoenn is really the best and ill die on this one
1,weekly questions bugs and gameplay megathread  march 
1,the spotlight corner
1,what pokémon can be added here
1,well this is frustrating
1,what type of invisible cp god pokémon does this dude have
1,theyre playing daily and opening my gifts but not sending any back should i delete them or wait
1,i dont really want to but i think soon ill have to get rid of some of my best friends
1,psyduck knows the hardships of life thats why psyduck cares
1,bad night pokemon hunting
1,drew my friend and i as our pokemon go trainers
1,this is my favorite nickname ive given to a pokemon
1,its tiny 
1,my first attempt at sewing i tried to make brendans hat for pikachu
1,great now there are two of them
1,new research got me like
1,seeing this egg but knowing you are the only player in town
1,who is your favorite mon to put into gyms for reasons other than its defending capabilities i like showing off my gross shiny shadow muk
1,my first regidrago is a hundo
1,good one niantic traveled  minutes for nothing  cant get into any
1,received a postcard from niantic hq
1,found out this is a actual poke stop
1,sorry i just have to show him off
1,there it is managed to get in miraculously
1,took forever to almost fully power up then evolve
1,got  people together in nz and cannot join raid group
1,got my halloween costume ready lol
1,team instinct  golds gym
1,gimmiegoul is soooo small in gyms
1,thanks a lot niantic
1,caught  shinies within minutes of each other
1,ive never seen everyone just hanging out before
1,it is finished 
1,so yeah this guys cooler looking than i invisioned lol
1,secondary account and got this
1,whats going on here
1,niantics in person focus going forward seems like it will be much worse for rural players especially
1,finally im so happy bro
1,little green spaghet 
1,who else gets this view
1,got in with  min to go and a weather boosted mon runs away
1,not perfect but i love her nonetheless
1,great news for me
1,theyre really pushing the boundaries of laziness to new heights
1,good luck everyone who have a morning shift on saturday for example
1,is the great raid box worth it
1,so damn close im gonna go cry now
1,eeeeee just got the best surprise ever
1,got a nice lucky trade from my friend d they got a shiny lucky rayquaza now tho xd
1,xerneas needs an adult
1,ew what the hell is this
1,shiny xxs level  smeargle happy friday
1,what are you doing stepgrunt
1,again thank yall
1,of all the pokemon
1,bring your kid to the gym
1,my long road of shiny ditto hunting is finally over yall 
1,atleast he left a gift behind
1,at this point i feel like niantic is just trolling
1,you got games on your phone
1,my th hundo after ish years of playing
1,genjutsu of that level doesnt work on us
1,finished my collection challenge today with this guy
1,im so surprised people actually play pogo in my park now had  ppl
1,do you have a friend that 
1,my first shundo
1,has anyone caught a lightersmaller gimmighoul
1,how do pvp ivs work because ive played this game for awhile and still dont quite get them though ive been told you want low attack high hpdefense
1,i was having an absolute terrible day but then i randomly came across this precious baby and everything turned around
1,got my fav shiny today planning to give it a new charged move and max it
1,its not much but its honest work
1,regidrago raids
1,just this burmy left that i cant find
1,has anyone seen an elite raid that starts at  pm
1,i swear to god ive been trying to get a shadow hundo for ages sigh countless beldums
1,committed to in game experience
1,finally after all these years
1,second bird captured
1,i present to you shiny kanto
1,i feel like im interrupting some kinda meeting
1,ive never got up from bed so fast in my life
1,managed to get  shinies today
1, excellent gold berry throws later
1,okay who named this pokéstop
1,guess whothe crabs
1,look at this random shiny i found
1,on the very last encounter too
1,caught a shiny in gbl
1,we should be able to hatch regional pokemon in k eggs from that region
1,i think i might have interrupted something
1,the best gift i have ever recieved
1,new favourite pokémon
1,are shiny odds boosted for this guy
1,when you are really laggy
1,the happiness when your job finally becomes a gym
1,this is my best bad luck in my good luck moment only one ball threw  caught
1,excited about my first shundo ever or should i call it a shitto
1,this update worries me
1,caught it today it was a regular natu caught on the rd ball
1,why is every hundo i catch like this 
1,wanted to show off my  favorite pokemon 
1,welplooks like theyre here to stay cheers to being locked from having certain pokémon for years or ever
1,looks like the gangs back together
1,hundo scatterbug 
1,after  sierra encounters this is in the top  of my pokemon collection
1,one of my favorite shiny pokémon that i own 
1,tough decision ahead
1,i know where i am going to be playing tomorrow
1,this little cutie was waiting for me outside my house
1,caught my first hundo through an egg
1,finally a shiny smeargle naturally photobombed by a regular smeargle
1,they must be out of their freaking mind to think anyone will buy this crap
1,easiest hundred wins ever
1,i finally got my first lycanroc
1,introducing shiny noiwear
1,i think i have a ditto incense th one and playing since dec last yr
1,guys i need a friends please help
1,k catches with only km
1,the pikipek army grows
1,is cosmeon really this small or is this just an xxs
1,why didnt i find any elite raid spawns after the elite raid
1,pleasantly surprised today went out with a friend and her fam but the lobby actually got full of players
1,is it worth evolving
1,my best gholdengo so far how are you guys doing
1,was hopeful since only  raid in the area but this happened 
1,i never have to tap on a shuckle again
1,youve seen enough shiny hoohs and smeargles at this point so i thought i may share my treasure do you like him and whats your proudest possession
1,made it to level 
1,finally i know it might seem dumb but im so excited i finally finished the research and got my mew 
1,why cant i give berries remotely anymore
1,what do you think of my party
1,regidrago raids mostly at am
1,why does this happen to meeee
1,the oldest pokémon in my collection somehow didnt get transferred before appraisal was a thing
1,what should i do i leveled it up before i knew ivs existed
1,whenever i try to play at my house gps signal not found  occurs
1,not bad for my first raid
1,lol is this a useless pokemon
1,first hundo of the year
1,regidrago raids working as of  am japan standard time
1,do you get a second golden lure five days after using the first one
1,regidrago raid possible with two people
1,was i able to catch this guy when my incense lured him well his name sure aint articuyes
1,catching a ditto
1,elite raid spawns not working
1,the legendary honoh
1,yup of course you cant raid
1,thoughts on this trade
1,omg my first hooh is a shiny hooh 
1,shundoh after  raids
1,question about levelup requirements
1,this was just on me on the screen as i just loaded the game up rather surprised it was a shiny just  short of mega energy for it 
1,thanks gio i think
1,low key flex here added another country to my gym map
1,theres always that one hombre
1, grimer encounters from field research two shiny
1,niantic  will be better literally hrs later woops sooorrryy
1, shinies today i love them
1,planning my regidrago trip tomorrow not looks good none at the mall all at parks though there are ex gyms at the mall and it raining not very hopeful it be anyone out there for the raid except hackers spoofing 
1,my first shundoooo
1,why does this gym have spot lights
1,gimmighoul gholdengo buddy ribbon
1,i believe this is a fair trade
1,going through pokemon doing a clear of storage and saw this
1,dont fckle with the shuckle  
1,i cant even get any of these ones because theyre all at  am and im busy then 
1,elite raids are kinda silly
1,hey got a question here 
1,been hoping for a ditto for a few weeks and finally caught my first one today at work super stoked was an ekans
1,does having outstanding missions for leaders increase their spawn rate
1,at work trying to get a shiny boi
1,raids cant spawn at this park today because theyre all elite raids for tomorrow
1,niantic our continued commitment to realworld play in pokémon go
1,my rarest nundo she acts kind of tough but he clearly is not
1,thought i finally caught a ditto after months but i was wrong
1,pogo connectivity issues wswitch
1,what should i name him
1,trouble connecting to scarlet and violet
1,to the person lamenting that all pokemon except theirs were healed i would love to heal them all but niantic
1,a huge thank you 
1,my st shadundo
1,what do i do with this cant evolve it and cant trade it
1,loading screen dragonite wspikey arm appendage cannot be unseen
1,fully green gym
1,thundurus really let themselves go
1,wow they only keep getting better
1,finallyyy after getting no eevees tuesday this is a dub
1,im about to give up on sierra attempt  i lost count not even a  star yet
1,only good shadow legendary purification prove me wrong
1,reddit surveys on pokemon go are wild
1,i got an interesting bug in pokemon go i would call it pixel art 
1,so close to greatness
1,i knew almost exactly what to nickname it
1,get ready for this guys
1,just got to best buddy with my shiny smeargle and got another one
1,my shiny noibatmy dear stelluna
1,pogo and pokegenie destroyed my gallery
1,just caught a shiny ditto hard enough to find a regular ditto
1,tried to get lucky legendaries got these instead 
