pokemon,title_cleaned
1,weekly questions thread  march 
1,rpokemon is looking for moderators apply within
1,crikey have a go at that beauty of a pokemon  steve irwin as a pokemon trainer  conservationist hope you like it
1,remade the pokémon sleep logo with a more deserving mascot
1,oc birb hisuian decidueye preevo concept
1,my favorite crackmon
1,oc  wanted to remake another classic from indigo league and what better episode than wake up snorlax how old were you when you first watched this 
1,litwick x kirlia
1,anyone else miss the evil evil teams
1,made an espeon rug inspired by the poke lids they have for manhole covers what do yall think  oc
1,the guy who discovered a new species of forest cockroach and named it after pheromosa left and me right drawings by him and shared with his permission
1,an important choice was made he did me proud squirtlesquad
1,a force more powerful than arceus himself i present dudududunsparce
1,pikachu blender d artwork
1,in light of recent and amazing news heres a sketch of pheromosa oc
1,oc drawing of arven with his mabosstiff
1,marshadow by me
1,little detail in platinum
1,the biggest decision shes ever made i think she chose correctly
1,people who enjoyed grinding in pokemon games how
1,it would likely never happen but a starter trio that was firegrass grasswater and waterfire is suprisingly balanced
1,cynthia  undella town animated wallpaper thumbnail
1,people say that every pokemon is someones favorite
1,hope you all enjoy my lego as alakazam moc oc
1,ive started d printing some of my poké ball designs
1,traveling in spaghetti code
1,pixel wooper love oc
1,mudkip
1,ancient ho oh vibes
1,can i transfer pokemon into bank from alpha sapphire start a new save and eventually transfer them back
1,i made pokémon card stainless steel pendants
1,inspiration for pikachu 
1,lil squirtle painting i did
1,our physics groups final project of the term launching groudon into space to fight deoxys
1,oc hanamiseason is practically here in celebration here is a sakura bulbasaur redesign as a built papercraft figure
1,thanks to the changes in breeding mechanics regarding incenses snorlaxs  year record of being the highest base stat pokemon capable of hatching from an egg has been broken
1,if youre finding playing pokemon a bit too easy heres something ive been doing to spice it up a bit more
1,oc riolus first python code
1,ekansarbok new evolution regular and shiny versions oc
1,another day another pokémon dessert heres chocolate covered cherubi 
1,scarlet and violet are my favorite pokemon games for a reason you may not think
1,after hours of tormenti finally did it
1,im looking for an old nintendo power
1,pokémon team for royalty
1,another one blaziken by me
1,what are your pokémon hot takes
1,accidentally suprise traded starter
1,sailor moon villains as pokemon gym leaders
1,buneary  pokémon
1,oc all of the behind the scenes work that goes into turning my artwork into enamel pins featuring the eeveelutions
1,pokémon cards
1,story time
1,supervisor gengar on duty
1,glalie or salamence who should i add
1,which pokémon lines would you merge in a future generation
1,quick question regarding reproduction pokémon games
1,hello i have some questions regarding streaming
1,looking for raids
1,do the old games really go for that much
1,i made some gengar on a swing pendants last week thought this group might like em  made by hand out of glass
1,poliwrath poses
1,questions about mega evolution
1,poke transfer lab  bwbw
1,how far in scarletviolet do i have to be in order to start doing raid battles
1,trying to balance the type chart by summing their strengths and weaknesses as close as you can to net 
1,emis daily pokemon ranking day  misdreavius
1,pokétuber mysteries
1,hi i drew a slowpoke
1,struggling with the rubysapphire pokenav trainers eyes rematches
1,earliest method of transferring pokemon gen  to gen 
1,im considering trying to do a living national dex can anyone offer adviceanswers
1,paradox aegislash and lunatonesolrock
1,brilliant diamond team help
1,the crown tundra dlc feels broken early game
1,rockruffian the firefighting evolution of rock ruff based on mahogany obsidian
1,here you go a scientifically accurate future paradox kyurem form
1,classic gen  starters
1,i drew all  original gen  pokemon on my phone oc
1,rocket trio makes its appearance will they be able to steal reds bag  read from left to right 
1,my own pokemon region
1,c r e a t i v e
1,looking for an open world d pokemon game where youcan catch pokemons train them and fight with them
1,made some roxie art
1,just got pokémon shield do i needshould i get the dlc right away
1,a rowlett cake i made for birthday
1,made a custom pokémon card based on persona 
1,translate and identify miscellaneous product purchased bought in pokemon store
1,repels dont work in ultra sun
1,gen  pokémon red what should my final team be
1,and i didnt get to save 
1,sobble
1,nosepass hand sanitizer  soapass
1,a onepage essay on why collecting pokémon cards as an adult is acceptable written brilliantly and in its entirety by artificial intelligence
1, magmar oc
1,beyond the main series thread  march 
1,pokémon team with one of their stats being very high
1,i made this drawing of latias and latios and im really proud of it theres the speed paint in the comments
1,how to unlock battle teams
1,will they add aegislash to sv
1,buying pokemon tcg scarlet and violet elite trainer box koraidonmiraidon
1,pearl white cetoddle needle felt
1,which pokemon game do you recommend to start with
1,why dont we have reverse eevee it would be such a cool mechanic
1,fiancé and i got almost matching slowpoke tattoos
1,the idea of a pokémon battle royal game sounds cool
1,if abandoned dolls transform directly into banette then where do shuppet come from
1,pokemon violet is my first pokemon game
1,oc i know its a little late for legends to of arceus but i couldnt help not drawing them
1,the iono gang made by me froof
1,my megadex is ready to view
1,i made this speed painting study of applin and thought some of you here would appreciate it too d
1, smoliv
1,i drew mimikyu as a banana split i call him mimicone 
1,give me a type and ill give you a team
1,first starter for my risk of rain inspired region petrichorian chesnaught
1,hey guys how does that copy of soul silver look i know its supposed to have a certain color against the light but couldnt find if it needs to be or not to be purpleish
1,does anyone know where i can find the pokemon oracion song that played at the end credits of the japanese version of the pokemon th movie
1,for fans of primal theory i have a theory about a certain similarity between meowscarada and a sabertoothed tiger
1,so now that we are a over a week into march i wanna ask those that have looked into it
1,i started a collection of d printable pokemon inspired pokeballs this time i made koffing cant wait to d print it 
1,oc which style do you like the most old watercolor style or digital one like they use now
1,did you know apparently theres a glitch in emerald where the thunder bolt sound will just keep playing until you reset the gamecube
1,made a wooper and shiny wooper 
1,my first gardevoir art
1,im a good  months early but i finished my christmas tree ornament project came out pretty cool i think im excited for christmas time
1,oc i drew riolu burning a tyre
1,what do only these  pokémon have in common
1,limited time events ie limited time terra raids are lame
1,some more progress made over the last few weeks on the kanto piece theres so many all drawn by me on my ipad pro using procreate please tell me what you think 
1,pokemon in super mario odyssey kingdoms
1,oc i drew my favorite paradox so far
1,baoppubaokkey cards
1,the legend of moltres reimagined mininimal wallpaper
1,funny fungi
1,day  my goal is to remake the pokémon rap with my models oc
1,my little vaporeon
1,ive been running a pokémon themed dnd campaign with some friends as part of the world building i made up some random companies and designed some logos for them my group was insistent that i share them here
1,gave one of my pikachus a heart tail ft the full adventure squad
1,just finished a new pokémon commission which pokémon youd have on your team
1,gastly oc
1,made some more sygna suits for rpokemonmasters that i wanted to share what do you think about these
1,working on a living national pokédex looking for advice tips suggestions etc
1,accidentally got hacked pokemon
1,oc paradox raikou based on the anklyosaurus
1,if there was a new d pokemon rpg based on the tcg for switch would you play it 
1,hi guys im thinking about some new series for my illustrations this time i wanted to unite naruto and pokémon in a single art and i would like to know your opinion which pokémon would the main characters of naruto have
1,just finished a commission of charmander from the saddest episode i ever seen i hope everyone enjoys it
1,not an artist but heres my first pokemon art of my favorite one
1,pokémon mezase catch em all  night tempo official remix
1,misdreavus  toads daily pokémon ranking 
1,should the galarian legendary birds be considered convergent evolutions
1,so hey am i the only one that absolutely despises the new breeding system
1,thatthing in the broom closet oc fanart done in procreate
1,shes naruto running my starter is a female so
1,new art i made for a girl on instagram through a photograph did you like it
1,mr mime evolution mastermime oc
1,oc selfmade hitmonlee card 
1,its a beautiful day in this region mr rogers as a trainer
1,my first and second times drawing old pikachu art d im new here
1,the explanation for every type
1,there wont be a new form of charizard because there is already paldean charizard
1,completely handmade pikachu with love pokerarium oc custom
1,the cuteness of pikachu
1,i put together a complete your pokédex  list including megagigantamaxregiongender differences
1,how great would it have been if we could play pokemon red gold  ruby within scarlet and blue silver  sapphire in violet on your characters rotomboy 
1,got it recently and it turned out pretty nice i think
1,i have made gorochu the deleted pokemon 
1,which of these pokegirls is your favorite
1,had to hit this guy with the plushification beam the minute i saw him oc
1,what do you think how will ogerpon and terapagoss signature abilities be like
1,what to put free cards in to pass out to kids
1,my pika themed pc case
1,hey would anyone like to join a pokémon rp
1,mimikyu art 
1,the puppy pokemon in lego
1,emis quickfire daily pokemon ranking days  sunkern line yanma wooper line espeon  umbreon murkrow  slowking
1,hello i was curious i know a few but what pokémon are good for their trainers actual health or just emotional support
1,happy international womens day
1,pokémon pun names
1,need help figuring out who to put in last two slots of my hgss replay
1,goodnight  good morning 
1,looking to make a team around jolteon and i dont know how to do teams can someone help
1,what is the best team for type coverage in sv
1,pokemon riddles
1,what pokemons were the johto trio
1,got sun stones oc
1,i drew these little guys for my sticker club march 
1,blueberry oddish cookies
1,the galarian birds as gen ii mons
1,am i the only one that feel lost
1,i only have black and white filament for my d printer and so i figured id make a premier ball afterwards i realized the inside of a premier ball is red 
1,snow storm hit recently and i just knew what i had to do
1,the magic words
1,a bug catcher dragon tamer team
1,how would you imagine the paradox pokemon remaining evolution lines looked like
1,what were your pokémon ingame teams
1,oc i drew my favourite pokemon  quagsire clodsire and wooper
1,oc gardevoir as a demon slayer
1,ice types should resist ground dragon and flying and do neutral damage vs water
1,oc so in conclusion
1,oc gen one combo poster by me digital drawing 
1, electabuzz oc
1,am i the only one who wouldnt mind a bdsp style faithful bw remake
1,wait a minute
1,machamp is menacing
1,can you hear the battle soundtrack too i loved doing this
1,arcanine
1,favorite dawn rival
1,pokémon yellow glitchexploit my sister accidentally discovered in the s cant find explanation
1,help from the pokemon family
1,oc aquatic oddity a paradox version of the galar fossils based on the eternally confusing fossils of the spinosaurus
1,mythicals haunt me
1,reading the pokémon manga for the first time and came across this
1,our office now supports the cursed leprosy pikachu
1,possible events or story plots hoping to see in pokémon 
1,i am participating in the paldea prologue tournament i just want some info on what to improve if i lose
1,if you could choose to live in a real pokemon world how would you do so
1,paradoxprimal reversion
1,oc my take on past paradox lugia silver tempest
1,its in portuguese but what theyre saying is practically that they named a newly discovered specie of cockroach after pheromosa
1,oc happy  birthday to me
1,playing through shield again as a non pokemon related oc 
1,academy possibilities
1,i turned pickachu into a fairyelectricpsychic type
1,based on your occupation how would you incorporate it into being a gym leader
1,pheromosa_irl
1,paradox ninetales oc swipe for the sprite
1,what are your fav three starters from each type these are mine 
1,if pokemon digivolved skeledirge
1,goofy ahh subtitle
1,useless fact 
1,squirtle rug
1,this here is a future form of sneasel and weavile essentially future forms are the reverse versions of hisuian forms
1,oc my custom self made cards  painted and crafted by me  hope i can finish the og  this year
1,oc mega sableye
1,pokémon type knockout round 
1,best way to get started with the card game
1,which mainline games made the biggest change to the pokémon formula
1,a persian card i filled in digitally
1,however the character looks really cool
1,mt moon hat souvenir 
1,oc lugia vs hooh made by me for commission
1,what legendarymythical will hint towards gen 
1,pokémon out of context 
1,new species of cockroach named after a pokémon  can you guess what pokemon it was named 
1,can no longer see the walking wake raid
1,oc some pokemon art ive done recently
1,why dont pokemon raids show the level of the boss so kids stop bringing their level  starter to the level  raid
1,pov you bought the dlc
1,new species of cockroach found in singapore named after pokemon character pheromosa
1,starting over
1,chienpao the movie director
1,team star let him cook
1,what is the largest pokémon
1,funny gamestop interaction i had while buying pokémon violet
1,can somebody help me in bulbapedia says that only steelix could appear in lvl  and for some reason are appearing pokemon in too high levels
1,art request my friend made 
1,eeveelution shadowbox
1,bulbasaur cap lineart
1,did anyone notice this
1,what would your own gym be like
1,pokemon the movie  burger king employee promo shirts lot of  deadstock find
1,my stylized version of mawile what do you thinkoc
1,koraidons power source
1,crocheted a pikachu 
1,what do you want in the dlc
1,pokemon energy cross stitch
1,pokemon fusion of sylveon and vulpix
1,ho oh and lugia  got these last summer
1,whats your favourite of every type of pokémon
1,which generation of games do you wish you had grown up with
1,oc commission for ghostlyoceans instagram
1,wiglett magolor i dont know why i made this either
1,does anyone know what this number represents from serebii pokeearth on the wild area
1,oc up next a paradox version of the porygon line  iron projector succeded where its ancestor couldnt and has abandoned our world to explore and record other dimensions
1,dear nintendo tpc game freak we need cloud backup saves for pokémon scarlet and violet now more than ever
1,we made a wooper animation
1,i made eeveelution keychains
1,oc i drew a mew for a tshirt and wanted to share the artwork
1,are there any pokemon that could be considered an unofficial convergent species
1,realistic blaziken
1,so about save files being deleted
1,day  finally finished him credit to the original concept goes to bluekomadori
1,espeon and umbreon stickers
1,shiny tattoo
1,b r e a k
1,fastest way to get through a game
1,i just earned and refused hooh from colosseums mt battle by accident
1,how to catch them all
1, tinkatink
1,made paradox forms for garchomp and metagross
1,how to get iron leaves in violet
1,oc afinity park  an aerial ambush pt
1,arceus spoiled me on how easy and fun it is to catch pokemon
1,slowking  toads daily pokémon ranking 
1,old website based fan game
1,its me ya boi graziyard
1,my and my friends pokesonas in pokémon cafe style drawn by me
1,walking wake and iron leaves will appear again in future events
1,should mushroom pokémon become their own type in the future
1,hi i recently composed this cover of jubilife city from pokemon diamond and pearl this is a cover for piano and cello i would to know your opinions about this track and any suggestions about the next cover i could compose you can listen to it everywhere spotify youtube apple music and etc
1,starmie evolution starrus oc
1,another looping animation for lock screens electrode this time
1,we need a new colosseumxd game
1,fun fact all star raid pokemon prior to decidueye are also all the pokemon on the pokemon unite homemenu art
1,oc painted this sabrinas gengar for my husband for his birthday last week 
1,made a chart of which pokemon can keep up with the player at different speeds sv
1,a new sv challenge inspired by the newly revealed pokemon terapagoss design opinions
1,drew the shiny variants of hooh  the legendary beasts
1,oc i made a human version of zacian did you liked it
1,if frontier brains were gym leaders what types would they use
1,found my old ds  copy of white id forgotten how much fun this is
1,come visit me in anistar youngin
1,what should i play next after pokémon sword
1,got dared to post this thing i drew on here
1,oc flamigo must be jacked
1,i made animated sprites for the new dlc pokémon
1, deoxys  playthroughs of oras easily one of the most difficult pokemon to get for a livingformdex
1,someones annihilape surprised traded away
1, pokemon in a cave
1,paradox pelliper by me
1,run
1,any ideas for an ability for each type that are equivalents of swarm torrent overgrow and blaze got any other ideas
1,how to check if pokémon are legit
1,dug out my old pokéwalker what do you think is is savable 
1,rediscovered this sketch i did from when fuecoco was announced
1,the implications of that pokémon café trailer are a bit gnarly oc
1,what vc games do you suggest
1,oc sneasler doll 
1,do you agree with chatgpts team build
1,butterfry a firetype butterfree
1,koraidon art doll i commissioned to be made
1,will be starting the games again starting from gen  up until the current ones any suggestions kindly read the whole post
1,sending out a special magikarp anyone out there still use this feature
1,i feel like this is a pokèmon ripoff but idk ad i got on youtube
1,almost forgot about these transformations
1,staring contest
1,is shedinja truly an evolved pokémon
1,ive committed another crime against the pokemon community i didnt learn my lesson after quagsmire oc
1,srsly i need switch online
1,should i allow wiglett in
1,some eeveelutions paintings i made 
1,event walking wake and iron leaves
1,lil concept i made umbreon x miku i plan on making the entire eeveelutions
1,help mystery magazine
1,its over youngster i have the high ground
1,pokémon kanto gym leaders chibi versions
1,pure rocktype pokemon  speed drawing
1,ive been working on a paradox pokémon roster for a while now it is far from done since i want to make  for each generation but i wanted to share these first ones
1,this year will mark the th anniversary of the release of pokemon pinball ruby and sapphire where is the new one
1,zacian is quickly becoming one of my least favorite pokémon
1,gen  does badge boost glitch only increase damage of normal hits
1,can i safely play pokemon scarlet
1,made a clay eiscue as it was snowing though it would be fitting oc
1,indigo league meowth
1,theres a little details about raids that people seems to not realize
1,what pokémon do you dislike and why
1,meganium made of pokemon cards
1,is there any actually scarydarkcreepy pokémon media out there if so what
1,what pokemon spinoff game you wanna see make a come back and what would be cool idea for a new spinoff titles
1,commission just finished oc
1,a pokemon spinoff i would love to see happen smash brothers but with just pokemon in it
1,drew some of my favorite pokemon in a rubberhose cartoon style oc
1,got bored drew a fusion meet moopip
1,we turned the accumula town theme into a punk rock song
1,eiscue practice  oc
1,made this wotc era character creation sheet
1,what do you think goldengho looks like
1,oc happy womens day i made aroma lady in my sketchbook
1,favorite game by music
1,im a animation fan who loves overthetop expressions and the sun and moon anime is a gold mine of them these four screencaps for example were all taken from the same scene in episode 
1,i crocheted an espeon and its just too cute not to share 
1,this was the artist that created the illustrations in area zero oc
1,yall are not ready for this talk yet
1,i stumbled upon this item at work and it just fit too perfectly
1,goofy ahh subtitle
1,name a pokémon and ill give you pokedex entries and info about it
1, jynx hi again i almost forgot about this place again well time to return posting my project oc
1,charizard in flight by me digital drawing 
1,i cant take my friend seriously after changing their profile to this
1,what do you most commonly hear about the pokemon adventures manga im trying to create a video essay about all the series misconceptions
1,my sister made this tattoo for me thoughts
1,youve heard of garganacl now get ready for
1,best choice ds eshop games
1,pokemon whiscash eats masterball
1,pokémon sim  after taking out a vullaby and catching a mandibuzz they have gotten much more powerful
1,my concept for a paradox sharpedo iron rocket oc
1,lysandre got a makeover oc
1,here comes the boi itsoneofthosenight the link to my insta shall be in the comments
1,what do you look for in a pokemon game aka what kind of pokemon player are you
1,gamefreak sure is creative
1,what have you nicknamed your pokemon
1,what moves should i have on my giratina before transferring it from platinum
1,light ball pikachu
1,terapagos themed challenge for sv if you do attempt please send me the results
1,ponyta in the rain 
1,is pokémon scarlet and violet enjoyable despite all the bugs and textures
1,evolution without trade
1,im not ready to say goodbye to my childhood hero and best friend  this was all drawn by me on my ipad pro using procreate 
1,i know that field is meant to comprise of the pokémon based off terrestrial animals rather than just mammals but its still odd in fact a lot of choices for egg groups are odd
1,oc my work so far 
1,my wife drew this for friends sons birthday
1,love how my hoodie is coming along
1,did you ever not get a thing from the box
1,i drew gardenia
1,i made a team of pokémon its literally just mons that i like could someone tell me if it would do any good against a friend
1,a customer gave me a huge pikachu costume
1,you guys remember legends of chima
1,darkrai x gardevoir
1,fusion gardevoir
1,names id give all the paradoxes
1,join my co op to help me evolve my finizen
1,th gen team inspired by the witcher 
1,comically large twisted spoon oc
1,a few of the pokemon beer labels ive been working on
1,does anyone know what this game pokemon is
1, of each pokémom vs the rumbling
1,tyrunt isnt evolving pokemon x and y
1,walking wake art by me
1,got commissioned to make a cute cyndaquil lamp for my friend oc
1,a new addition to my leg today 
1,red blue and yellows ost as well as their remakes are far superior to every other pokemon games soundtrack
1,question about the games and their consoles
1,slugma regional form new evolution oc
1,another of my old fanarts with my sona in pla setting im planning to redraw it
1,aggron armor  golem wrecking ball
1,my fan art scream tail singing and jigglypuff with envy 
1,getting back into the pokémon games i played as a child should i use hypno over alakazam
1,i painted some pokemon from memory in horizon vr on playstation 
1,what even are the dna splicers
1,what episode is this from
1,walking wake loaf
1,day  wip going to take two days to finish charizard because he is one of my all time favorite pokémon im already liking how he is feeling and im excited to finish him
1,gen   gen  adding awesome eldritch abominations oc
1,a few weeks ago people were talking about kantos geoghraphy and posting maps but i didnt see this one
1,hes almost finished
1,evil lusamine
1,which character has the best design
1,arven oc
1,diantha full art d pokémon card truly love how this one turned out id love to know what you think oc
1,theory of evolution not quite what it seems
1,what pokémon can exclusively be caught in the redblue safari zone
1,friendly reminder vigoroth has a red  on his face this is why i love vigoroths design
1,best sinnoh region gba version game
1,i was given a nice surprise when i bought used copies of some ds games
1,hatterene oc oc
1,i have fused  gen 
1,heres my take on this format express thy opinions
1,i laugh every time i rewatch the finale
1,murkrow  toads daily pokémon ranking 
1,im tired of massuda methoding rowlet but also excited for the next stuff coming up
1,i d printed the eveeloutions
1,i made these mimikyu ice cream sundae stickers
1,legendary hooh
1,me and my group of friends get a  on a test
1,froslass art oc
1,whats the deal with pokeballs
1,walking wake painting oc any thoughts
1,i drew my violet player character
1,game freak to this design after 
1,safe to play now
1,seaking evolution garlord oc
1,pokemon puzzle league is jut rng hell
1,i made greninja out of lego oc
