pokemon,title_cleaned
1,when i evolved i thought this dude has hair aloha region rocks
1,my first shiny that isnt hot garbage
1,should i upgrade and evolve the metang or beldum
1,did not expect this what can i do with this
1,thought on gym update idea
1,shes a beaut 
1,which one should i use elite tm on
1,what should i do with this guy
1,omg no way
1,tips for finding raid groups
1,what in gods name is this thing
1,just realized the jangmoo that spawned at my house the other day was a nundo
1,finally caught one
1,i work near this gym  of my free time during the shift is fighting someone on blue team for the gym i just cleared red out of but finally some local instinct has my back
1,my first one what do you think
1,still bummed my boy will never know kinghood
1,is this worth an elite tm for sacred fire
1,why did i just notice the female one has red lips 
1,and now for candies
1,nice first lure spawn
1,i like the look of mega medicham
1,interesting daily incense
1,opened pokémon hoping for the shiny shmeagle and this was my first catch of the day i dont think i can complain 
1,the real reason that carnivine is a regional
1, team leaders beat i can finally pass this grunt up
1,who should be my next buddy both are rare
1,buddy gardevoir laying down on the job
1,still no dumb blue dog
1,has anyone seen any  regidrago eggs
1,pokemon rewarded me for playing at work
1,i have megaevolved
1,show off your shiny haul im looking forward to seeing what yall name them
1,worth purifying or evolve in shadow form
1,the tutorial has been completed
1,the most lucky ive ever been
1,shadow pokémon question
1,lets be honest can we just call it snowshrew instead
1,and to think i almost didnt click on it
1,remember to feed your good boys lots of tacos when youre out
1,are there increased encounters of ditto ive caught  in the last  days after not finding one since 
1,first raid on ho oh
1,i actually caught a hawk
1,did they brick the game for ios 
1,what pokémon is it that i need to evolve
1,gmail account deactivated
1,cant login to account i havent used in years i have my main account which still works fine
1,my prized possession
1,in my first try lucky
1,when will the make a new friend quest be fixed
1,female salandit
1,holy my first and only hoenn tour egg
1,hmm doubt but it sure is cute to see my best buddy angery
1,are pokemon that you dont have in your pokedex considered special trades
1,my eevee buddy isnt sitting on my shoulder
1,having one aerodactyl quest is cool having two at the same time is pain
1,new favourite pokémon
1,gbl anybody else surrender if type disadvantage
1,talk about luck first pokémon i got today
1,any of these guys worth investing resources in im starting to get a lot more into the game but dont know who is useful
1,very excited for when mega tyrannitar comes out
1,one of my absolute favorites mega hundo scizor
1,played years ago when it first came out now my  and  yo kids got me back into it  shinies in my first week back
1,my galarian zigzag stocks are surging
1,are these gyms just not gonna have other raids for the entire day
1,im so happy my first shiny from a raid not a shundo but im proud of it either way
1,what is this pokemon the icon means i have to evolve it right
1,dead metagross buddy
1,my th shiny he just looks so damn good
1,what pvp iv is acceptable to use  invest stardust
1,did they change how gyms work
1,my heart i have such plans for you little one
1,is this good for any battling google isnt telling me much
1,thoughts on its name
1,vivillion is best thing to happen to pogo
1,deeper character customization
1,should i keep under cp or max out
1,another one of my silly pokemon
1,should i keep him as is or purify
1,how do you battle rocket leaders
1,finally all the shiny eevees are mine
1,am i genius or what
1,the absol piano
1,who should i evolve not for fighting but as a collectable
1,not bad research task catch
1,did i just get stupid lucky or is it a guaranteed hundo from the special research
1,updated top  pogo
1, regidrago in a casual player park in washington state  think i think have better chance at the mall
1,i didnt knew they could be shiny
1,grab one of its tails and end up with a  year curse
1,will this reward stay after the festival ends or expire with it
1,what ivs do you typically look for to know a shadow pokemon is worth investingmaxing is this larvi worth powering up
1,i know im gonna get hate for asking this but should i purify one of these lugias i dont have a normal one with good ivs and if i purify one of these theyll be decent ivs i dont plan on raiding for more lugia when it comes back because i prefer to use remote passes for pokémon i dont have yet
1,got this little man this morning
1,whos that pokemon
1,dugquatro thought this was kinda funny
1,question regarding elite raids
1,top comment names my new stunlock
1,purifying shadow pokemon
1,elite raids   per how many gyms to expect
1,after  raids and no catches i was rewarded
1,so close yet so far 
1,i got the research and rewards for willows wardrobe but i never paid for it
1,mons appeared but i turned off the game got back to see them if one is shiny which they werent then i appraised them and look what i got th hundo
1,the pain at least no hundo but still pain 
1,evolving rockruff
1,purify for mega or keep as shadow
1,living in a small town sucks should be a way to pull our pokemon back after sometime
1,i need a good move set for my dream pokémon solageo
1,name change not working
1,very happy to have finally gotten my favorite pokémon as a hundo
1,my st nundo mixed feelings it not something great or competitive or shiny but atleast the hunt is over for one
1,after  attempts finally galarian zapdos
1,which one is worth the trouble
1,my th shiny
1,only  encounters total
1,should i purify this ralts and have it as a mega or keep it shadow
1,the luckiest ive ever been  would you believe these were backtoback catches
1,a picture i framed at work today
1,swipe to see the explanation of this cringe meme
1,this looks like an adult woman toy
1, hours im not up to date so what is this please
1,feeling blessed on this fine day
1,is this good or useful at all
1,does only a single elite raid spawn in a smaller city
1,anybody wondering if this will come to pokémon go soon
1,is anyone getting elite raids after 
1,my first shundo i didnt even realize he was perfect until now
1,gbl rewards trash
1,is wobbuffet good for pvp
1,my first hooh is well
1,game not launching
1,afraid of elite raids
1,even though he is my th one i still love finding these
1,will i be able to join this if i dont have an ex raid pass
1,got two shiny hoohs in back to back raids tonight even made a joke about it happening then it did got a shiny smeargle immediately after too
1,tips to find noibat in the wild
1,is it worth giving my  shiny kyogre surf instead of origin pulse
1,feeling pink
1,any resources on finding ex raid gyms
1,toronto where will you be going to raid regidrago
1,elite raids tomorrow
1,whenever these monstrosities stop spawning im sending every one into the shadow realm
1,great i think
1,on my last one and just found out that catching exeggutor also counts when completing the task catch  exeggcute i thought id share to those who didnt know yet
1,the game really said its tiny
1,is this worth leveling and evolving
1,had some crazy luck today
1,my most prized possessions
1,the knight in shiny armor
1,thats number two 
1,was it something i said
1,pokémon taking cafe of me when im sick
1,help cant figure out this pokémon what is it and how do i get it
1,is pokemon sleep finally arriving this summer
1,this guy was the first hundo i caught a month ago since its not a big name pokemon i dont know what to do with it any suggestions
1,rate my shinies
1,please more info about the elite raids
1,please join me in boycotting these terrible devs
1,been playing since no shundos but i just caught this
1,is this a wild spawn
1,im gonna tell people im ash ketchum because on the day i left pallet town
1,what do you think 
1,one of my old pokemon doesnt have a place it was caught in how did this happen
1,ive been playing consistently since  i just got my st and nd nundos in two weeks
1,i got from my last snapshot of the day to
1,caught a galarian articuno while using my poké ball plus today
1,finally got a shiny after about  hours of raiding
1,does anyone know this pokémon its the last one i need for the collection challenge
1,i can finally have a hundo metagross 
1,how to evolve ursaring
1,hoenn tour nightmare
1,this is a sing to check you pokemon for a nundo
1,i am new to pokémon go and only started my account on the th january i just reached level  today very excited to continue playing and collecting even though i feel like i dont know what im doing half the time any tips for newbies
1,wow definitely happy with this one
1,mr krab shiny 
1,just an average day in ohio for us pokemon go players
1,is there a common place to trade pokemon
1,my shiny luck recently has improved
1,what are these things coming out of pokestops
1,k win milestone on my old partner since summer  ex beta testing days
1,should i purify my dratini 
1,after a long journey
1,not trying to brag or anything but can i use this in pve is it worth spending dust on
1,jessie and james come get your pokémon
1,i love my tiny shinys that are normally supposed to be large
1,first nundo in my  years of playing kind of down with it being a smeargle tbh
1,yesterday i caught a hundo smeargle now this 
1,pokestops are now farting
1,anyone seeing this i see this a lot in one region and after a train ride its nowhere to be seem
1,purify or not even any good as a shadow
1,awww i also love deering they are too adorable
1,should i power up or trade
1,lucky shiny noivern
1,game is in french but you get it the worst thing may be the fact that its marketed as a sale 
1,i caught a wild nicki minaj
1,how to deal with spoofers
1,should i purify my pokemon 
1,show me your burmy collection
1,so glad i can finally mega evolve my  medicham what an absolute unit
1,go girl give us nothing 
1,awww i love deering they are too adorable
1,my goto sassy sticker that i send when friends arent sending me gifts back for a long time  anyone else have stickers that send a message
1,can anyone explain what im doing wrong
1,do you think this would work for my catch  exeggcute task i think i know the answer already but i dont want to risk losing the chance to get one more if i can
1,finally got a blue ponyta first catch of the day too
1,nostalgia first shiny  years ago
1,what
1,well hello there o my first xxl hundo
1,has anyone else had this i was remote raiding hooh and touch inputs werent working had to restart my game after the raid luckily i could still catch it
1,pokegenie says it has good enough stats even for pvp but id really appreciate feedback from people if this guy is worth the stardust
1,is shadow feraligatr good or should i purify for the hundo 
1,evolving graveller to golem in lets go
1,i give up catching galarian birds ok not really
1,oh no hes multiplying
1,what can i even do with these notgood stats
1,i finally did it
1,almost got my first shundo but not quite
1,has anyone recently completed the loudred task for thousand year slumber none of my snapshots are registering ive turned the ar feature on  off made sure the app was up to date restarted the app  also tried on ipad took snapshots from the item bag poke bag  buddy window iphone user btw
1,anyone free and kind enough to help me with this raid  
1,how do players of similar level to meor even lower have insanely high distance walkedam i missing something
1,i wonder whos in the rocket balloon
1,thanks to the reviewers
1,my modest shiny collection aint much
1,can anyone tell me what the point of this feature is
1,kinda funny that this badge is a girl no matter your gender made me double check my avatar settings 
1,well hello mr smeargle
1,gf is jelly boiiiiiiii
1,really hoping to get lucky with this last egg
1,this made me very happy
1,i have a question
1,thats only a few listed off
1,niantic why is maractus a regional if this is possible maractus is the only cactus pokémon found in the desert resort
1,this meowth has been spawning in this exact spot for like a week even if i catch it
1,to the friend who joined and left after i invited
1,hahaha that joltik is so small
1,would yall power up  evolve and charge tm brutal swing or wait till the day you can evolve for brutal swing
1,elite raids are an amazing feature and the community overreacts every time they come around
1,a shiny paras and a hundo one  got them today they were side by side
1,super rare find sadly it ran away
1,help i have no idea what this one is can yall tell me
1,my two rarest shinys i think what are the rarest shinys you can get
1,first time seeing this guy it didnt instantly flee but i only had normal pokeballs 
1,what is this egg
1,my perfect special bb boy 
1,the elusive woowooberg
1,what should i name this fella
1,after going through all my saved coins and remote passes for rayquaza not to shine this was a welcome surprise on my second raid
1,why does shiny onix look like diarrhea
1,limitation with mega evolution
1,lf local players for elite raids
1,this was my first one wow
1,at least it was shiny 
1,i love shiny honchcrows animation
1,mega energy from spinning gyms
1,decided to do my smeargle encounters and got blessed with back to back shinies 
1,i have no friends who play this game no one in the community i live in plays this game no regidrago for me
1,now there are three of them  im too stubborn to delete it
1,found this in the wild 
1,a truly perfect lizard
1,is this a rank up reward or somethingim new to gbl
1,as yes definitely landorus
1,dont fuckle with the shuckle
1,niantic playing with my feelings runs everytime  is there any particular reason for it
1,the weirdest things make me laugh heres krabby dabbing
1, more zapdos to the collection
1,is there any reason why the reward for thundurus is candy for the crab
1,caught bro interrupting me feeding mewtwo
1,with everyone tanking this season this has just gotten so easy
1,i would like to show you my boy
1,losing has never been so worthwhile
1,ive been a fan of the pokémon franchise for  years now and still i have no idea what the heck this is
1,keep in mind the golden lure modules duration isnt affected by events
1,getting close to a full lucky dex
1,switched from a best buddy umbreon to a woobat took a pic when suddenly
1,i was really starting to think he doesnt exist
1,what will this be
1,which should be my primary fire type for master league
1,the terpene trio caught them all as is and will eventually have them as best buds
1,leet nundo i have had for a while
1,returning player advice
1,what does this egg mean
1,finally got the shiny wobbuffett family
1,question about lucky pokemon i have   pokemon
1,disappointed in the lack of creativity from this community
1,make love to the canvas
1,espurr in the shiny pokédex is complete chaos
1,this is so cool
1,it got away any tips for future legendaries
1,ho oh in the snow  snow oh
1,my great people pls help me with this purify or nah what you doing thank you for your help cos i havent been able to decide and its been over a year have a lit evening cmon mufc
1,what was everyones first shiny
1,i spaced out after hoenn tour so i was surprised and confused when this guy popped up 
1,this mentally hurts me
1,from my shiny smeargle i then got a shiny lapras as my st ever lapras and it was on the last spawn in the daily incenseeee hahahaahha my shiny luck is insane it was legit the last incense spawn that it didnt even register in the summary hahhahahaha
1,my two best shadow beldums so far if it comes down to these two which one would you evolve
1,old time player from  returning to the game got any advice
1,finally caught a hundo
1,finally got my pup
1,i probably learnt about shadow pokemon and ivs too late ill share my pain with you guys
1,krabby is so disgusted he wont even look at them two nasty mons
1,golden lure psa
1,apparently my natu is  inches tall
1,name change not working
1,adding this to my list of pokemon that dont look different shiny
1,my first shundo in  years being at level 
1,played a while ago quit friends decided to play again i wanted to join them
1,first nundo thanks to the event
1,what am i supposed to do with this
1,my very first nundo
1, out of  of my hoenn tour kms were tropius aside from the effort of freeing up space for the kms the chances were against you in collecting all three regionals
1,should i trade for shiny rayquaza
1,i might suck at math but this doesnt seem right
1,groudon and kartana decided to swap places
1,is this a normal thing im new to the game
1,two semesters of college
1,right before i was going to get a shiny smeargle from a trade man
1,catch rate for legendaries
1,i finished not so lucky this time
1,when you finnaly get a shiny eevee during some random event while studying for midterms
1,unable to link pogo to violet
1,another rainy day another hundo shadow ducklett if i purify why cant i find a beldum  metang with this iv 
1,are there any conditions when moltreszapdosarticuno appears when adventure incense used
1,less than ten runs and came out alright  am is the time to grind and south korea was very good to me also i name all the legendaries i keep after the citys mayor cheers
1,finally caught all the exeggute just to be stuck for another  years 
1,well thats odd
1,adventure sync not working with google fit
1,ar black screen glitch
1,meme shadow aexeggutor dropping dracos on unsuspecting trainers is satisfying when it lands 
1,isnt this supposed to be the shiny version
1,got my first shiny smeargle
1,best pokémon imo
1,rate my first ever charizard recently mega evolved
1,dont forget about the event tomorrow
1,gift from a shiny mega legendary
1,just caught a galarian bird
1,looks like we found pesto from the old animaniacs lol
1,which one should i max out
1,whos collection is better me or my gfs answer based on rarity coolness and self preference the one at the bottom is surskit
1,looking to progress in gbl how can i improve my team
1,rate my shiny collection 
1,first lucky friend he lives in a different country though
1,any idea what research task this is
1,what happened here
1,just caught this girl do i evolve or keep i dont know if aninetales is good in combat
1,one and done babyyy
1,just gonna flex this here
1,first ever hooh shiny 
1,prayed for a cp beldum or a shiny and look what i got
1,a meme i made after catching tornadus
1,first ohho raid and it was a shiny
1,this egg popped up i havent heard about it from the event
1,i cannot believe my eyes rn
1,the importance of bestlucky friends
1,my wife just hatched this im sharing her triumphs to flex vicariously
1,shiny smeargle
1,when do overworld spawns get an update
1,caught backtoback shinies while laying in bed ive never been so hype  the burmy is a male also 
1,got more busted snapshots  pics
1,should i evolve chansey
1,i love the weather system
1,caught this dude today
1,bidoof number 
1,im not getting revives after raids
1,my first ever shundo
1,sierra and her shadow entourage
1,is this shadow mon very useful if not im going to purify for the hundo
1,what pokémon may complete my great league squad
1,do evolved pokemon no longer give candy from walks
1,fucking finally
1,aita for reporting a incorrectly placed pokestop and gym
1,worth the stardust
1,is it worth raiding hooh 
1,got a lvl  shiny onix from daily incense
1,has anyone else had this thought
1,not having very good luck lately
1,bruxish haters when they wake up and see this
1,pokemon go stays on a white screen when trying to catch a pokemon
1,not sure how everyone else feels but i love including hundo in the names of my  star mons
1,well this was unexpected
1,finally one step closer to 
1,what is the best overall team for great league
1,should i max out my bruxish
1,just hit  i started playing serouisly in october feel like an adult now 
1,wonder how rare a super small shadow pokemon is
1,does it keep its hat if i evolve
1,new player in need of help with pvp
1,i think the nickname fits
1,fellow aucklanders or jafas who eles is going to be hitting the regidrago elite raid tomorrow morning at am the one at the  rans statue
1,remote raid passes for inperson elite raids
1,anyone else get this email i was going to fill it out but its already hit the max responses 
1,is there anyway to know how many research tasks i have stacked
1,shiny regionals available in the wild now
1,im at this point right now and im waiting for the right mon
1,look at who was creeping around my house this morning
1,not suspicious at all
1,out of nowhere but ran away
1,spawns like this get me way more excited than galrian bird encounters
1,hello fellow pokemon go players what pokemon do i have to evolve to get this
1,finally got my hands on one
1,ah the things that make me love this game
1,rd shiny green bean for march season although i already have  of these from december
1,spun the pokestop a bit too hard this time
1,i would have a shadowy aura if i had these ivs too
1,i got my first shundo
1,unable to authenticate error but only in a certain location
1,there might be an issue with my pidgeot
1,big ol stinky axe skunk
1,character customisation
1,it took me awhile to get here but yay level  
1,th bird caught lucky
1,cant say im disappointed but man does it hurt to get these back to back
1,shout out to everyone who still hasnt done this yet
1,i think this is a one and done for me unless more spawn around my house
1,whack weve had enough of you
1,my first hatched shiny
1,does anybody know what this symbol means
1,what should i do pump all my candies into my metagross or evolve my other beldum
1,im in complete shock
1,purified this xl beldum b i knew that you should leave them as shadow 
1,boys the  iv goat
1,excited for this one
1,saw a post about this today didnt think i would get one
1,we should be able to battle powerful pokemon in the wild to increase our chances of catching
1,i love that they never fix simple things like this
1,safe to say im quite upset
1,should i evolve this one or try more
1,how does campfire app work
1,how much damage does yawn actually do
1,does rayquaza normally fly that high or is this a bug
1,is this worth purifying
1,is he good i started to play again recently and found this guy on the box two stars for the shadow is good or bad
1,yo this big mouth is nundo name for it
1,postcard sending  day bonus question
1,theres something to be said about not paying attention to the random encounters one has and the transfers made when a few wobbly pops are indulged oh boy i wish id paid more attention ps i transferred the  shiny without thinking
1,am i naming my pokemon appropriately
1,i dont want to sound silly but im kind of new to the game anyone have any idea what pokemon this is looks like i need to evolve something to catch it according to the symbol but im not familiar with the silhouette any help would be appreciated thanks in advance
1,ok i think my luck is out for the rest of the year lol nd raid
1,is there still time to finish this or did this end up being a waste of 
1,first shadow hundo
1,i have lugia but i dont have dialga 
1,what a way to start off my day
1,are my top mon good for being lvl i feel like i should have more counters for raids and more cp mon but im not sure
1,why is my mega gardevoir sideways
1,mega aerodactyl indeed
1,my gotcha caught this before i could tap it is this good
1,looking for a farfetched anyone got an extra
1,smeargle photobombing smeargle
1,just got back from hawaii brought back a few souvenirs
1,what is your oldest pokémon and your oldest shiny
1,uh first ever hooh and its shiny 
1,my th ever smeargle encounter and got a shinyyy tbh as a low level player my shiny luck is insane
1,i know shes basically worthless in gbl but still happy to get a hundo of this uggo
1,hes doing his best too bad powerlifting doesnt earn candy
1,should i powerup for master league has metal claw and stone edge
1,should i purify this to make it a hundo
1,is it that hard ditto suddenly transforms when catching a pokèmon and zorua spawns as your buddy and then transforms
1,will i keep the wish granted research once the buying time is over
1,ivs arent great but still pumped
1,im back with another set guys im the guy with hella lucky pulls from about a month ago if anyone remembers at all im going for round two
1,always looked at those high level players with shiny legendaries and thought yeah that will never be me today on my first ho oh raid that changed
1,sense everyone is deciding to post there shiny hooh i might as well join 
1,k cp alakazam
1,its not a hooh its a hundoh
0,digimon world next order switch  pc versions general discussion  information thread
0,digimon ghost game episode  the black zone of death  no episode next  weeks
0,while i didnt notice as a kid as an adult it really changes the tone of the scenes compared to the original japanese music 
0,found at my local fye digimon branded milk tea
0,super happy with how this turned out
0,my gf got me this for my birthday im turning   no shame
0,ichiban kuji digimon digimon ultimate evolution a b  c figure lottery prize images
0,daydreaming
0,eviction day the gift pulsemon held on to his home lab as long as he could but hell love his new home in the arena app
0,digimon frontier stitches products at anibirth digimon partners  toei museum plus in store event
0,finished my next order challenge run with no exe and st generation mega
0,you are tasked to make more recolors of the original digidestined digimons what would you do
0,digimon color raising info from monmon memo
0,took me a full day to build this modle
0,digimon card battle  bandai card festival  and championship  finals report
0,andiramon armor fanmade  artist ミトスパ qsiqydfzneshw
0,i dont remember if i posted it here but here it is another page from the manga
