pokemon,title_cleaned
0,is there a place to read and post digimon fanfic
0,updated digimon amv playlist
0,digimon ttrpgs
0,bancho oneesama  artist 一平 gtmwd
0,zero arms digibeetle
0,digimon world next order rant
0,kingetemon evolution illustrated playmat staticfox
0,im new to digimon can someone give me a quick introduction
0,who is the best mega female demon
0,finally he has arrived
0,the poll may have not lasted long but congrats to guilmon for winning the poll saiki will have a great partner now dont worry tentomon fans  i have something in store for yall  
0,blue
0,digimon world leomons theme
0,you ever have a great idea for a digifake but cant bring it to life because you have absolutely no artistic talent
0,whats your most unpopular digimon opinion
0,go and sleep somewhere else_open commission_dm please
0,give me a digimon and ill give you my opinion on it
0,digimon world next order switch
0,question about next order
0,i am the only one who thinks mamemon and bigmamemon should be retconned
0,digimon mmo
0,where is your goddramon now
0,god grade appmons evolution trees who is your buddy appmon and what is its evolution line
0,with the will podcast episode   the not so nice houseplant ghost game episode  discussionreview
0,good alternative vital bracelet bands
0,a walk through the art museum video footage by me
0,im about to play my first ever digimon game and i want to dive deep into the franchise
0,a question to the fandom
0,so apparent there was another black seraphimon
0,the poll is here
0,next order for the switch
0,i need help
0,birth of the dragon emperor by badluck
0,which do you prefer canoweissmon or siriusmon design
0,i couldnt help myself only got  doubles in the process
0,if you know you know
0,when you punch it so hard that he flies off the combat zone
0,looking to trade dims any takers on these  looking for spirit flame and spirit light since everywhere i look is expensive af tsh and mbr are previously used on the neon green wrist strap vb angoramon and jellymon are new and unused no original packaging but they all have the display cards
0,what do you guys think of this line up for a team
0,flamedramon armor
0,digimon evolution line game  you know the rules and so do i the digimon for this one isnt a rookie for once the digimon is titamon and the theme is good to evil have fun
0,why did they screw up the order of their names in card order ex  ex
0,the mutant kuwagamon from todays episode that was on screen for  seconds got mad drip
0,incorrect quote by neotamine
0,art by 使い魔枚チャレンジ中
0,project survive ii  been working on a couple partner posters
0,digimon evolution vote vol  vote for digimon to appear in bememory part  official digimon web poll  part 
0,digimon world next order upset digimon
0,how does one acquire the preorder digicores
0,made a new kamen rider ooos combo using the best trio
0,vpet for a yearold
0,a guilmon drawing i made i know it doesnt look good but ok
0,cast for a digimon story idea
0,try to get blackwar growlmon and blackwar greymon but my digimon dies
0,anyone else want another digimon rumble game
0,a cool area idea for my dndigimon idea
0,digimon question cause im interested
0,renamon fanart what do you guys think
0,question to digimon world next order steam with ps controller
0,somebody teach this kid stranger danger
0,next digimon story possibility of ghost game dlc
0,charcoal drawing of agumon i did
0,half down half to go painting wargreymon
0,loogamons mega should be like liger zero schneider from zoids
0,gammamon is looking a bit wonky in the most recent episode of ghost game lol
0,first tattoo
0,the most pointless character in ghost game
0,digimon xross question
0,digimon michael bay movie
0,does it bug anyone else that everyone in the english dub of next order refers to it as machinedraymon instead of machinedruhmon
0,tamers  artist 맛톤이사라리우ラリウ grskmot
0,i cant be the only one but the animation looks slightly off her in the newest ghost game episode some scene look great but then theres this
0,sora vs zoe in a boxing match
0,just finished my run of digimon world next order
0,tokomon pain
0,hokuto in the last episode be like
0,ideas for ultimate and mega forms for  digimon by youtuber karn ex
0,call back to ghost game episode  when hiro finds all the bodies in the room that turn out to be arukenimons victims with their heads taken off
0,i can of course only take so much of terriermon
0,is kari implied to be chronically ill in some way
0,digimon card game booster set  clean parallel cards  printable playmat
0,am i the only one who hopes that someone would leak the last remaining episodes as the wait for  weeks is killing me already
0,heres my black gatomon line for a digimon fanfic i have planned
0,finished adventure  so heres an updated anime tier list
0,does gammamons scarfbecome part of his body
0,list of gulusgammamons victims
0,yamaki mitsuo in digimon young hunters
0,spot the angewomon remains
0,spoiler just watched digimon adventure tri part  and  the other  havent watched yet and i already have many questions
0,anyone think its weird we have few female bug digimon
0,drawing of nanomon i finished recently oc
0,digimon ghost game episode  profile art social images from nat  aoi tada digimon fan meetup photos from kenji watanabe a bunch more  week catch up
0,we finally get to go to the digital world
0,first time in next order
0,are there any digimon lines that stay adorable no matter how far into the line you get
0,digimon adventure  the beginning coming in  well maybe
0,why life sucks so much not a place to post this but i like this community
0,what is a good game to start playing to get more into digimon
0,what would be the best rookies for these two
0,dm buttons sometimes dont register
0,lapras digimon champion form 
0,under kowloon level 
0,what color should i paint my d printed digivice
0,digivice question
0,digimon world  question
0,with this episode and the last few i dont really know if there really gonna end and make a new season
0,a character art for my digimon young hunters character yuha saito
0,the digimon fan meetup was a lot of fun
0,preview for digimon ghost game episode 
0,rare canon image of wargreymons open mouth
0,digimon adventure dub coming spring 
0,im going to be streaming digimon world next order at pm est come say hi
0,digimon super groups
0,digimon world next order intel iris low end pc
0,anyone else get goosebumps thinking about the first time we saw things in the original series
0,digimon seekers
0,strongest of the demon lords
0,which rapidmon would you give a different name and what would it be
0,headcanon about the crests
0,havent heard anyone talked much about this lost browser digimon game called digimon circle
0,i found these old drawings i made of digimon and appmon from before i took a break from drawing i became a perfectonist they must be about  years old so i was about  i censored my name
0,wanted to show off my new tattoo here felt really appropriate with my name meaning light 
0,digimon world next order  does using fruit really matter while training  the ones that i used dindnt increase mucha stats  the difference between normal training and using fruits is almost the same
0,lost evolution evolution confusion
0,the new run buttom in next order is way better addition than expected
0,why people dont like digimon survive i havent played it yet but the trailers looks really good
0,ghost games third last episode was a mess thedigiknows episode  review
0,i need advice which of these gotsumon lines do you think is best im open to mixing and matching them too
0,digimon ghost game episode  preview screenshots
0,digimon world next order intel hd low end pc
0,not the best season by any margin but this got me good
0,what should i watch or maybe play after ghost game ends
0,i know theres a story reason behind it but how is that fair
0,interested in digimon question about the games
0,japanese voices missing from next order eu refund
0,mimi vs kari in a boxing match
0,why 
0,does anyone know if the switchsteam ports of next order have the dlc included eg from the malevolent fist
0,digimon cross question about christophers father
0,the nd page of vpet digimon sprites all mega digimon this time accidentally colored in platinumnumemons wings 
0,renamon using diamond storm
0,digimon ghost game  fanarts of the week  someday cthulhumon someday edition
0,recently im into recording videos and im really having fun  not the most knowledgeable tamer but it is really recording and playing so i wanted to share
0,digimon evo line game 
0,their dynamic is refreshing and fascinating to watch
0,what made you a fan of digimon
0,gallantmoncm_dianamon commission done_open commission_dm please
0,did i get the right vital bracelet
0,i have a few question for anyone who decided to get the nintendo switch version of digimon world next order
0,to celebrate the ending of the donbrothers sentai i made the comascot of digimon into a donbrother
0,digimon world next order disappointing
0,vamdemon movie
0,was the demidevimon in adventure supposed to have been devimon from the st arc reborn
0,woah is that wezengammamon
0,currently doing a nostalgia play through of dusk
0,project digidestined with you
0,single path digimon
0,digimon tri on peacock
0,few questions about next order
0,royal knights quests for the digieggs
0,cs on a homebrewed vita is serotonin inducing
0,red  black base blackwargreymon x decklist  bt
0,i lost being unprepared but im shocked i found a match just now on cyber sleuth for the switch does anyone else still play
0,name three mega digimons that you would like to have as a partner
0, years ago i create my oc digimon this week i finished her evolution lines i planning make her dark evolution soon
0,drawing practice of gabumon art by me
0,renamon gaming
0,little babies are here
0,digimon vpet xa care mistake doubt
0,before i get japanese copies of the ps vita games
0,thoughts on the young hunters who leapt through time
0,digimon survive wrathful ending continuation
0,what digimons in your opinion would be equivalent to egyptian gods from yugioh
0,what was your first champion in digimon next order 
0,little did we know he would be right just not for ghost game
0,tyrannomon evolution line staticfox
0,the sphere
0,female partner for male digidestined
0,xevolution
0,help me find this fanart i saw a years back
0,i made some digimon ocs  so ill share a few
0,in your opinion what digimon should be a royal knight ill go first
0,should i turn off my vitalbracelet be if i am not exercising
0,hypothetical next order mods
0,dynasmon line
0,beginner
0,blackwargreymon
0,in fanfiction do you prefer existing digimon to be used for herovillain roles or original digimon invented for the story
0,toyagumon evolution extremely cursed except the last part
0,should i buy digimon hackers memory
0,for anyone playing next order aftet the release check out the guide by the legend mrwfy
0,digimon world next order intel hd  low end pc
0,is it just me or next order doesnt look as good as redigitize
0,i have been having intrusive thoughts about this for years and i would like to tell yall about it
0,can i still preorder the vpet color
0,digimon world next order delay
0,creative exercise creating a digimon castteam
0,so how many vpets running at a time is too many
0,words cannot express how much i love this card
0,fav digimon in season 
0,did they announce a release date for tcg online or will it never come
0,how to deal with a snu snu mon
0,hopes for the next story game
0,which title should i purchase
0,digimon world next order chapter  boss
0,according to this modder new game  is actually already in digimon world next order without needing a mod to add it to the game
0,to my fellow switch owners who preordered on amazoncom
0,digimon world next order mod
0,round  describe jellymon in four words i go first top tier digi wife 
0,a dim card for all that are magical and mighty
0,finding remaining bug plates in lost evolution
0,my vpet case
0,angewomon by _ish
0,anybody else here at the la convention center 
0,holyangemon got betrayed lol
0,digimon card game booster set  called blast ace
0,low key for real the digimon chicks are kinda all pretty cute when they get older like especially sora
0,here is my personal thoughts as well as recapping at least episode  to 
0,is it a rare sound card
0,gotta say i miss kotemon in the games
0,i dont have a problem i can quit anytime i want
0,watching  and i like skullknightmon being gatomon cus  it acknowledges her being myotismons minion in og adventure and  is foreshadowed in a way because the purified version of her mount is her miracle armor
0,so i just heard the latest news
0,digimon card battle  booster set  match
0,have yall read vtamers
0,is there team building in next order
0,man after so long digimon fusion just feels weird watching
0,should i buy world order on console for 
0,uncolors your greymon
0,help a newbie on where to start
0,a question regarding a fan game
0,young hunters and tamers artstyle practice
0,gaia is going to die
0,fyi japanese audio is included on the switch port
0,my take on a digimon fighting game roster based on the anime
0,time traveler moves a chair the timeline
0,i need advice on how to get agumon and gabumon in digimon next order
0,help displaying vpets
0,picked this badboy up the other day cant wait to relive the memories
0,they use the crest of light in hogwarts legacy d
0,model sets
0,under the signing for the fan meetup who is mr kobayashi
0,digimon fusion season  eps  dvd impossible to find
0,demiladydevimon oc fakemon
0,wargreymonx  blackwargreymonx bt deck profiles
0,now describe guilmon in two words me first bread baby
0,watermoisture under vital bracelet be
0,so im watching digimon adventure season  and im on episode  why the slight art style and lighting change
0,amazing experience to draw it almost from memory
0,digimon and computer science
0,digimon cyberheroes
0,i realize its mostly just all the talk of digital in the lyrics but ive always thought this song from phineas and ferb would work well in digimon media
0,when someone makes a fan digimon fighting game roster but frontier has the least amount of reps
0,this week i buy those  games cant wait to play them but i dont know wich one i should start with
0,a small introspection of digimon where i even designed my own digimon evolution and animated it
0,wake up community new digimon lore just dropped
0,bagged my first ever set of pendulums recently
0,next order what things reduces lifespan
0,i drew angewomon
0,my current vpet and dim card collection
0,my digimon video reached the funny number nice of views a few days ago
0,i drew more digimon based on their vpet sprites this time with a thicker outline can you recognize them
0,has anyone already found next orders config files to add custom resolution and such
0,image not mine apparently this guy exists its like a robotic walking and talking guilmon which unfortunately does not have steve blums voice like the anime a very interesting and niche product does anyone in this subreddit own it curious to see
0,if sephirothmon is supposed to be the beast spirit of steel then wheres the steel at
0,visiting japan in april id like to go out of my way to visit some places from the shows
0,digimon games
0,is digimon next world order worth it
0,here is gravimon which i draw last year everybody calls paper for his body
0,canoweissmon protecting curimon 
0,ghost game plot
0,question about vital bracelet
0,digimon x digipet
0,angewomon by me
0,ladydevimonangewomon theme swapredesign
0,anyone get their digimon world preorder
0,ive heard that tyrannomon needs a dedicated rookie rather than sharing agumon could the answer have been in front of us this whole time
0,digimon adventure  bd showcase plus dvd vs bd comparison
0,fuck you bandai namco at this point theyre intentionally sabotaging their own franchise
0,so one of my favourites digimon world next order came out on platforms other than playstation today heres the first review ive seen posted but i think its better than they did underrated game
0,you think neomyotismon will show up in the new movie that way all his forms are covered in the adventure continuity
0,digimon tri question
0,lapras digimon 
0,rapidmon d printable resin statue by fedebordond
0,digimon application universe
0,the vital bracelet got me back into digimon so heres pulsemon from today meeting the mons from childhood
0,need info on talking culumon
0,next order delay
0,what are good digimon to connect labramon to mercurymon
0,a meme about the last ghost game episode
0,no launch bonus dlc for nintendo switch
0,where can i get a vital bracelets be in tokyo
0,poll results for favorite digimon added to reference book in  part  plus combined results for all of 
0,everything is better in color
0,digimon journal  shinegreymon burst mode mugendramon  mummymon
0,elecomons true evolution
0,its on
0,digimon world next order pre order bonus question
0,what are the most fitting megas for shogungekomon avaiable
0,where to buy a terriermon charm
0,its the rd anniversary of digimon adventure last evolution kizuna
0,tris story could have been better but i cant complain about the digimon designs i really like that style a lot can anyone tell me which artist made them
0,best application for making custom digivolution charts
0,current head canon for where each baby ii is categorized
0,a friend who isnt a huge digimon fan did a blog post about his favorite digimon designs
0,beginner mode in next order should be the normal
0,ruuuun
0,what info on the new digimon movie is out
0,digimon world  battle theme  s gaming music  i believe this is the most epic version you will hear on the internet
0,im high on copium
0,nefertimon finished ig is so small you cant really appreciate the detail and effort i put into her armor i love egyptian stuff so this was a blast you can follow me too to see more  donnymon
0,psa digimon world next order  no japanese audio on switch
0,omegamon vs omegamon zwart drawing
0,the most overrated and overhyped digimon ever i dont like him
0,digimon ghost game finale is episode  hiatus is  weeks  episodes left plus    titles
0,describe gammamon in one word ill start baby
0,so longe bowser
0,do you want a ghost game sequel
0,should i buy digimon world next order
0,digimon world next order complaints
0,can kendogarurumongarummon fly
0,recently wrapped up my ps collection
0,vital bracelet be questions
0,why did i think raising  digimon was a good idea
0,fun digica  booster set  unboxing
0,d grayscale based on a preexisting d image that wasnt in hatchgrayscale
0,feebas digimon baby form 
0,digimon world next order is out for switch and pc much different than cyber sleuth and survive review below 
0,magnamon blue custom figure
0,hello guys can someone explain me what digimon seekers is  is it a new gameanime
0,does anybody know anything about this growmon toy
0,english pendulum th
0,bearmon and gryzmon evolutions
0,wanted to share my top  favorite digimon games what are your top 
0,my ocs digidestined final part
0, quid for a switch port of next order what the hell are they thinkingi
0,my first attempt of creating a digimon evoluton inspired by ronso from ffx icall it ronsomon
0,light on his feet  my symbareangoramon entry for the digimon illustration competition print preorders available oc
0,is second gen the earliest you can realistically start battle training in next order
0,next order releases tomorrow so why is steam still saying coming soon 
0,digimon card game rd anniversary magnamon parallel card lottery details for japan
0,digimon next order first half hour of gameplay how can there not be at least a k option
0,photos  sticker previews for digital monsters th anniversary book digimon device  dot history book
0,digimon world release feb nd nintendo switch 
0,live action digimon
0,look who got caught at black mesa smh
0,ive played a lot of games older and newer but dw is still peak digimon game to me
0,what is digimon seekers
0,digimon adventure screening  hiromi seki interview in vrchat  times in the next month
0,totally epic digimon oc
0,oh boy digimon world next order switch version releases in a few days
0,i just started collecting figures wondering if there are any others like the aplified versions
0,received the game today i just hope i can change the voices because english dub just wont do it
0,dont talk to me or my son ever again
0,dmo still playable
0,a devitamamoninspired commission oc
0,it took ages but i finally found them
0,partners lets make digimon goods together project  digimon frontier premium music box image announcement  preorder info
0,i drew botamon koromon agumon and devimon using vpet pixel art as a reference for fun critique appreciated
0,i miss the tamers
0,so what are your guys thoughts on this
0,the pc port of next order is lazy
0,does anyone know what happens when your digimon gets hungry on digimon adventure anodecathode tamer
0,weird question can you do any digimon voices
0,extyranomon digivolution line
0,karma
0,leopardmonduftmon line
0,who likes digimon card games
0,shaded figure rise magnamon  i tried but its harder than it looks
0,added this legend to my collection
0,digimon ocs and their canon counterparts goin together like oil and water
0,in cyber sleuth why havent the stat boosting foods appeared
0,my ocs digidestined part ultimate
0,loogamons evo prediction
0,masaru touma yoshino ikuto satsuma  miki and megumi parallel previews for digimon card game booster set 
0,digimon world 
0,feebas digimon xantibody 
0,royal knights free for all
0,gammamon fishing
0,which digimon do you want to see in anime heroes figure form
0,digimon survive affinity question
0,why isnt there much regulusmon fanarts
0,ive been playing through next order and i really like the animation of the psychemon  black gabumon looking at you when you approachpass by i drew the pose i liked the most from memory so it may be a bit off with the gabumon color pallet let me know what you think
0,its a bird its a plane its jhon cena
0,digimon lost evolution
0,does anyone know where i can watch our war game english dub
0,question about the vbbe and dust
0,what is your unpopular opinions about the digimon anime
0,vintage greymon and tai shirt from the s
0,just found this amazing poster in the dvd 
0,pvp digimon games
0,art saberlilamon a gallant warrior powerful and sweet another commission i did i loved bringing her to life see below comission i did for tanakaclinkenbeard
0,with the will podcast episode   the ghost game is finally afoot ghost game episode  discussionreview
0,turns out you cant go home again
0,where are the other royal knights
0,i made an evolution line to match the meme as closely as possible most of this is actually possible in digimon story cyber sleuth
0,so this was a reference to the call of cthulhu ttrpg right
0,digimon seekers content at digimon fan meetup linker band  character costumes
0,episode  spoilers you just know things are about to go down with the death violin music and all the characters trembling with fear
0,digimon rp
0,dmw dont worry still working on it
0,hello everyone i cant transfer my digimon from my vital bracelet be to the digimon vb lab app i have a xiaomi note  pro  g the nfc is enabled and i followed the instructions found in various videos on youtube etc im still stuck on the waiting screen with the first dot flashing 
0,is just me or unlike certain past official arts the current tcg artworks looks more cute than suggestive
0,milotic digimon 
0,my fiancé and i have this inside joke right now where we randomly go spiriiiiiiit like they do in digimon frontier when first getting their human spirits 
0,using other anime symbol what crest can this represent
0,digimon original tcg
0,if bandai announced a remakereboot of this digimon serieswhat would you love to see and what do you think it should be improved or changed
0,my oc digidestined part adult
0,whats your goto mega level digivolution for myotismon x and why
0,just a heads up that the physical version of digimon world next order may be releasing on the th for you
0,the two cutest digimons meet at last 
0,parenting tips
0,demiveemon line as pokemon cards
0,burst modes alternate parallel previews for booster set 
0,digimon world early battle theme
0,i am ready for more news on the next story game
0,so the newest episode had me thinking
0,animon stories sounds like the perfect ttrpg system for a digimon campaign
0,xaura vs final aura
0,my collection over the years  you can tell which series im biased towards
0,good rookie and mega for airdramon
0,im tired of buying cr batteries has anyone had luck with rechargeable alternatives
0,digimon card game rd anniversary key art
0,i have to say this episode was nutz
0,sakuyamon commish done today happy with renamon at the back mostly haha oc
0,i have a question about something people refer to when they talk about gammamon in the ghost game anime
0,just how tolerable is the plates mechanic in lost evolution
0,pick your fighter
0,anyone know where to buy a digimon vpet kenji watanabe edition in australia
0,digimon ghost game episode  profile art ghost game clip selection social media photos jellymon bememory chart  week catch up
0,th anniversary digivice in japanese
0,digimon ghost game episode  the call
0,my digimon february merch haul 
0,preview for digimon ghost game episode 
0,ghost game theory
0,i got to meet brian beacock today at a convention he was really chill and was happy someone knew digimon
0,zeroarms beetle digibeetle concept art
0,digimon lost evolution  ancient warriors question
0,any alternate omnimon designs
0,best digimon adaptation
0,my ocs digidestined about opposites and xantibody
0,about loogamon
0,i have a few physical cartridges leftover for pre order is anyone is interested
0,i remember these
0,i am having an issue with the app
0,moba for digimon
